{"version":"builder-definition/v1","builder_id":"builder:fixture-a","backend":"fixture-subprocess/v1","architecture":"aarch64","image_digest":"sha256:6b86b273ff34fce19d6b804eff5a3f5747ada4eaa22f1d49c01e52ddb7875b4b","toolchain_digest":"sha256:d4735e3a265e16eee03f59718b9b5d03019c07d8b6c51f90da3a666eec13ab35","environment_digest":"sha256:4e07408562bedb8b60ce05c1decfe3ad16b72230967de01f640b7e4729b49fce","network_policy":"denied","root_policy":"isolated-temp-root","high_trust_classes":["bootloader","device-tree","firmware","kernel","mesa","release-index","userspace-package"],"definition_digest":"sha256:4e937d36bb0d350c506a7d2f8e681b921bfd377352ea858e6d8e9bf60d5aa9a6"}
