{"version":"builder-definition/v1","builder_id":"builder:fixture-b","backend":"fixture-subprocess/v1","architecture":"aarch64","image_digest":"sha256:4b227777d4dd1fc61c6f884f48641d02b4d121d3fd328cb08b5531fcacdabf8a","toolchain_digest":"sha256:d4735e3a265e16eee03f59718b9b5d03019c07d8b6c51f90da3a666eec13ab35","environment_digest":"sha256:4e07408562bedb8b60ce05c1decfe3ad16b72230967de01f640b7e4729b49fce","network_policy":"denied","root_policy":"isolated-temp-root","high_trust_classes":["bootloader","device-tree","firmware","kernel","mesa","release-index","userspace-package"],"definition_digest":"sha256:d17832bd1b213fc02eabd50cd74e8ac98600a9fa64e40e94c11f7b87d43aa2aa"}
